### ISSUE TITLE
Can't get MQTT to work with Fresh Element Solo with firmware v1.267

### ISSUE THREAD

**Issue by LukeMondy** [dwyschka/localkit#29]
I wasn't able to get my FE Solo, with the latest firmware to talk to the localkit broker.

My localkit IPs are 10.13.1.31 and 32, where 32 is the broker.

I got Claude to help me, and this was the summary we came up with:

## Network evidence

1. DNS rewrite is applied. AdGuard query log, client 10.13.1.143:
a3ne3fxrt9x.iot-as-mqtt.eu-central-1.aliyuncs.com   Rewritten → 10.13.1.32 (A, ttl 10)
The feeder re-queries this every ~10–12 s (i.e. it is actively retrying), and resolves it to the broker.

2. Broker is reachable and its TLS is valid (run from another LAN host, not the Docker host — macvlan blocks host↔container):
$ nc -vz 10.13.1.32 443
Connection to 10.13.1.32 port 443 [tcp/https] succeeded!

$ openssl s_client -connect 10.13.1.32:443 </dev/null 2>/dev/null | openssl x509 -noout -subject
subject=C=DE, ST=Bayern, O=Sensou, CN=*.iot-as-mqtt.eu-central-1.aliyuncs.com
So a normal TLS client completes the handshake against the broker.

3. The feeder's own attempts fail at the TLS layer. Captured on the macvlan parent interface of the Docker host while the device retried:
$ sudo tcpdump -i ens18 -n "host 10.13.1.143 and tcp and port 443"
One representative connection to the broker (.32):
10.13.1.143.62124 > 10.13.1.32.443: Flags [S]              # SYN
10.13.1.32.443 > 10.13.1.143.62124: Flags [S.]             # SYN-ACK
10.13.1.143.62124 > 10.13.1.32.443: Flags [.] ack 1        # established
10.13.1.143.62124 > 10.13.1.32.443: Flags [P.] length 338  # device: TLS ClientHello
10.13.1.32.443 > 10.13.1.143.62124: Flags [.]   length 1440
10.13.1.32.443 > 10.13.1.143.62124: Flags [P.] length 99   # broker: ServerHello + Certificate
10.13.1.143.62124 > 10.13.1.32.443: Flags [.] ack 1540     # device acks the full cert
10.13.1.143.62124 > 10.13.1.32.443: Flags [P.] length 7    # device: TLS record, 7 bytes
10.13.1.32.443 > 10.13.1.143.62124: Flags [F.]             # broker closes
TCP connects, the broker sends its certificate, and the device replies with a 7-byte TLS record and the connection is torn down. New connection, same pattern, ~every 2 s.

4. The 7-byte record decoded. Same capture with payload, filtered to the small push packet:
$ sudo tcpdump -i ens18 -nX "src 10.13.1.143 and dst 10.13.1.32 and tcp[tcpflags] & tcp-push != 0 and less 80"
...
10.13.1.143.53139 > 10.13.1.32.443: Flags [P.], length 7
        0x0020:  ...............  1503 0300 0202 30
The payload 15 03 03 00 02 02 30 is a TLS record: type 0x15 (alert), version 0x0303 (TLS 1.2), length 2, level 0x02 (fatal), description 0x30 = 48 = unknown_ca. Identical on every retry.

5. SAN cert ruled out as the cause. The default broker.crt is CN-only (no subjectAltName). Replacing it with a self-signed cert carrying a matching SAN (confirmed served — the certificate flight grew from 1348 to 1539 bytes in capture) produced the identical unknown_ca alert.

---

So yeah, it's not wanting to talk to the broker.

It could just be that the new version of the firmware (1.267) doesn't want to downgrade to localkit's 1.262, maybe?
But does that mean we'd need a new firmware blob made?

Thanks for the hard work!

**Comment by dwyschka** [comment]
Did you apply the "firmware update"? Its neccessary to talk to the broker.
Petkit uses CERT Pinning, my patched firmware, replaces the Petkit-Cert with my own, so that connection is available. 

Can u send me a screenshot of your device-details? a screenshot of the "detail view" would be enough.

**Comment by LukeMondy** [comment]
Yes, I tried to apply the update, but the device doesn't seem to want to update. 

What version does your firmware present as?

I can get you a screenshot a bit later, sorry.

**Comment by dwyschka** [comment]
Are u using main or beta? 
maybe try the beta-image.
i Updated the ota-stuff.

**Comment by LukeMondy** [comment]
Oh, I was on `main` - I can give `beta` a go.

The rollback to stock firmware feature would make me feel safer though 😅 

Happy to close this issue until I try the `beta`, if you want?

**Comment by dwyschka** [comment]
I let it open :) 
The Rollback-Function is half-implemented. in case, i just need a "repositroy" with the real-firmware urls, than its fine.

**Comment by dwyschka** [comment]
Hey! I got another "it doenst work"-request. 
I added some fixes to the beta-branch. Maybe now? Im waiting for the answer of the other guy :)
